{
"schema_version":"0.1","supplier_id":"SUP-TAOBAO-2215377569695","record_status":"PENDING_VALIDATION",
  "identity":{"legal_name":null,"display_name":"RECCI锐思礼品工厂店","supplier_type":"RETAILER","legal_entity_status":"UNVERIFIED","country":"CN","region":"Dongguan, Guangdong","address":null,"website":null},
  "platform_profiles":[{"profile_id":"PROFILE-TAOBAO-257498860","platform_code":"TAOBAO-CN","store_id":"257498860","store_name":"RECCI锐思礼品工厂店","store_url":"https://shop257498860.taobao.com/","relationship_to_supplier":"UNVERIFIED","verification_status":"PARTIALLY_VERIFIED","ratings":[{"metric_code":"POSITIVE_FEEDBACK_RATE","raw_value":"99.72%","raw_scale_max":100,"normalized_score":99.72,"count":null,"observed_at":"2026-08-26T02:19:24Z","evidence_refs":["EV-SUP-TB-SPEAKER"]}],"observed_at":"2026-08-26T02:19:24Z","evidence_refs":["EV-SUP-TB-SPEAKER"]}],
  "business_signals":[{"signal_code":"SALES_COUNT","subject_profile_id":"PROFILE-TAOBAO-257498860","raw_value":"商品详情总售2","normalized_value":2,"unit":"orders","period":null,"confidence":"MEDIUM","observed_at":"2026-08-26T02:25:00Z","evidence_refs":["EV-SUP-TB-SPEAKER"]}],
  "capabilities":{"supported_procurement_types":["STANDARD_PRODUCT"],"items":[{"code":"LOGO_CUSTOMIZATION","description":"企业礼品Logo定制","status":"CLAIMED","confidence":"MEDIUM","evidence_refs":["EV-SUP-TB-SPEAKER"]}],"service_regions":["CN"],"lead_time_claim":null},"qualifications":[],
  "assessment":{"advantages":["店铺好评率99.72%","商品标题显示Logo定制能力"],"disadvantages":["法律主体、10件定制MOQ和费用未确认"],"risks":[],"overall_score":null,"score_status":"NOT_SCORED","exclusion_reasons":[]},
  "pending_confirmations":[{"field_path":"identity.legal_name","question":"店铺对应的法律主体及营业执照信息是什么？","priority":"MEDIUM","blocking":false},{"field_path":"capabilities.items.LOGO_CUSTOMIZATION","question":"10件Logo定制是否承接，费用和交期是多少？","priority":"HIGH","blocking":true}],
  "evidence":[{"evidence_id":"EV-SUP-TB-SPEAKER","evidence_type":"API_RESPONSE","source_url":"https://item.taobao.com/item.htm?id=726948050702","captured_at":"2026-08-26T02:25:00Z","supports":["identity","platform_profiles","business_signals","capabilities"],"excerpt":"店铺好评率99.72%，详情总售2，标题标示企业礼品定制Logo","content_hash":null,"confidence":"MEDIUM"}],
  "provenance":{"created_at":"2026-08-26T02:30:00Z","updated_at":"2026-08-26T02:30:00Z","created_by":"Procurement-price-comparison Agent","collection_run_id":"taobao-search:ze7AJWJmw088Ft8Yu;detail:Zjm9RFTial7ixtjLf","overall_confidence":"MEDIUM","assumptions":["平台店铺与法律主体关系未核实"]}
}

