{
"schema_version":"0.1","supplier_id":"SUP-TAOBAO-2221388302698","record_status":"PENDING_VALIDATION",
  "identity":{"legal_name":null,"display_name":"淘宝店铺474475096","supplier_type":"SERVICE_PROVIDER","legal_entity_status":"UNVERIFIED","country":"CN","region":null,"address":null,"website":null},
  "platform_profiles":[{"profile_id":"PROFILE-TAOBAO-474475096","platform_code":"TAOBAO-CN","store_id":"474475096","store_name":"淘宝店铺474475096","store_url":"https://shop474475096.taobao.com/","relationship_to_supplier":"UNVERIFIED","verification_status":"PARTIALLY_VERIFIED","ratings":[{"metric_code":"POSITIVE_FEEDBACK_RATE","raw_value":"100%","raw_scale_max":100,"normalized_score":100,"count":null,"observed_at":"2026-08-26T03:00:00Z","evidence_refs":["EV-SUP-TB-DESIGN"]}],"observed_at":"2026-08-26T03:00:00Z","evidence_refs":["EV-SUP-TB-DESIGN"]}],
  "business_signals":[{"signal_code":"SALES_COUNT","subject_profile_id":"PROFILE-TAOBAO-474475096","raw_value":"详情总售400","normalized_value":400,"unit":"orders","period":null,"confidence":"MEDIUM","observed_at":"2026-08-26T03:05:00Z","evidence_refs":["EV-SUP-TB-DESIGN"]}],
  "capabilities":{"supported_procurement_types":["SERVICE"],"items":[{"code":"RESIDENTIAL_DESIGN","description":"全屋装修效果图、施工图和3D建模","status":"CLAIMED","confidence":"MEDIUM","evidence_refs":["EV-SUP-TB-DESIGN"]}],"service_regions":["REMOTE"],"lead_time_claim":null},"qualifications":[],
  "assessment":{"advantages":["店铺好评率100%","详情存在总售400信号","标题覆盖主要交付物"],"disadvantages":["主体、作品质量、修改轮次和两周交付未确认"],"risks":[],"overall_score":null,"score_status":"NOT_SCORED","exclusion_reasons":[]},
  "pending_confirmations":[{"field_path":"capabilities.lead_time_claim","question":"150平方米项目能否支付后两周完成，包含几轮修改及哪些源文件？","priority":"HIGH","blocking":true}],
  "evidence":[{"evidence_id":"EV-SUP-TB-DESIGN","evidence_type":"API_RESPONSE","source_url":"https://item.taobao.com/item.htm?id=1005370435991","captured_at":"2026-08-26T03:05:00Z","supports":["platform_profiles","business_signals","capabilities"],"excerpt":"店铺好评率100%，详情总售400，标题覆盖效果图、施工图和3D建模","content_hash":null,"confidence":"MEDIUM"}],
  "provenance":{"created_at":"2026-08-26T03:10:00Z","updated_at":"2026-08-26T03:10:00Z","created_by":"Procurement-price-comparison Agent","collection_run_id":"taobao-search:xBCzOoUGGfjWL4hZ5;detail:GXHGlkIYWvoHL07TB","overall_confidence":"LOW","assumptions":["未联系服务商，公开描述不视为正式承诺"]}
}

