{
"schema_version": "0.1",
  "supplier_id": "SUP-1688-MASCOT-001",
  "record_status": "PENDING_VALIDATION",
  "identity": {"legal_name": null, "display_name": null, "supplier_type": "UNKNOWN", "legal_entity_status": "UNVERIFIED", "country": "CN", "region": "Dongguan, Guangdong", "address": null, "website": null},
  "platform_profiles": [{"profile_id": "PROFILE-1688-2218283287713F8E88", "platform_code": "1688-CN", "store_id": "b2b-2218283287713f8e88", "store_name": null, "store_url": "https://m.1688.com/winport/b2b-2218283287713f8e88.html", "relationship_to_supplier": "UNVERIFIED", "verification_status": "PARTIALLY_VERIFIED", "ratings": [], "observed_at": "2026-08-26T03:05:00Z", "evidence_refs": ["EV-SUP-MASCOT-001"]}],
  "business_signals": [{"signal_code": "TRANSACTION_COUNT", "subject_profile_id": "PROFILE-1688-2218283287713F8E88", "raw_value": "成交20+；订购信号29", "normalized_value": null, "unit": null, "period": null, "confidence": "LOW", "observed_at": "2026-08-26T03:05:00Z", "evidence_refs": ["EV-SUP-MASCOT-001"]}],
  "capabilities": {"supported_procurement_types": ["CUSTOM_PRODUCT"], "items": [{"code": "MASCOT_CUSTOMIZATION", "description": "泡沫/EVA人偶服来图定制", "status": "CLAIMED", "confidence": "MEDIUM", "evidence_refs": ["EV-SUP-MASCOT-001"]}], "service_regions": ["CN"], "lead_time_claim": null},
  "qualifications": [{"name": "1688认证信号", "qualification_type": "PLATFORM_VERIFICATION", "issuer": "1688", "identifier": null, "valid_until": null, "verification_status": "PARTIALLY_VERIFIED", "evidence_refs": ["EV-SUP-MASCOT-001"]}],
  "assessment": {"advantages": ["存在人偶服来图定制和平台认证信号"], "disadvantages": ["法律主体、完整工艺和10天交期未确认"], "risks": [{"risk_id": "R-MASCOT-001", "category": "CAPABILITY", "severity": "HIGH", "description": "页面信号不足以证明能按指定材料和还原度交付", "mitigation": "询盘并审阅案例、材料说明和排期", "status": "OPEN", "evidence_refs": ["EV-SUP-MASCOT-001"]}], "overall_score": null, "score_status": "NOT_SCORED", "exclusion_reasons": []},
  "pending_confirmations": [{"field_path": "capabilities.items.MASCOT_CUSTOMIZATION", "question": "能否按指定材料、约10kg和下单后10天完成？", "priority": "HIGH", "blocking": true}],
  "evidence": [{"evidence_id": "EV-SUP-MASCOT-001", "evidence_type": "API_RESPONSE", "source_url": "https://detail.1688.com/offer/817907206474.html", "captured_at": "2026-08-26T03:05:00Z", "supports": ["platform_profiles", "business_signals", "capabilities", "qualifications"], "excerpt": "页面返回店铺ID、认证、成交及来图定制信号", "content_hash": null, "confidence": "MEDIUM"}],
  "provenance": {"created_at": "2026-08-26T03:10:00Z", "updated_at": "2026-08-26T03:10:00Z", "created_by": "Procurement-price-comparison Agent", "collection_run_id": null, "overall_confidence": "LOW", "assumptions": ["未询盘，公开宣称不视为已确认能力"]}
}

